{
  "timeline_id": "HITL-EIMM-001",
  "title": "Human Infra 永生史年表示例",
  "version": "1.0.0",
  "description": "从正式时间线 timeline.json 抽取的三个示例事件，演示引用式来源与时期契约。",
  "updated_at": "2026-08-06T08:30:00Z",
  "events": [
    {
      "event_id": "HIT-MTH-001",
      "title": "古埃及金字塔文出现",
      "date_start": "-2353~",
      "date_end": "-2323~",
      "date_type": "range",
      "period_id": "period-ancient-egypt-old-kingdom",
      "civilization": "Ancient Egypt",
      "region": "Nile Valley",
      "path_family": "philosophical",
      "event_type": "religious",
      "claim": "古埃及现存较早的《金字塔文》把死后复活和升天纳入王权、尸体保存与宇宙秩序制度。",
      "summary": "金字塔文表明早期永生观首先是围绕法老死亡、仪式和来世秩序建立的制度性叙事。",
      "sources": ["SRC-001"],
      "evidence_grade": "M",
      "verification_status": "unreviewed",
      "status": "draft",
      "significance": "turning_point",
      "uncertainty": "文本形成和固定时间存在学术争议，暂以约公元前 2353-前 2323 年作为参考窗口。",
      "cross_links": ["HIT-LIT-001"],
      "chapter": "神话、来世与灵魂不朽",
      "notes": "示例事件。"
    },
    {
      "event_id": "HIT-THT-006",
      "title": "培根《生命与死亡史》出版",
      "date_start": "1623",
      "date_type": "exact",
      "period_id": "period-early-modern-europe",
      "civilization": "England",
      "region": "England",
      "path_family": "maintenance",
      "event_type": "thought",
      "claim": "培根主张通过系统观察研究衰老、营养、呼吸和身体修复，把“延长生命”纳入自然史和实验知识计划。",
      "summary": "该文本标志着长寿问题开始摆脱纯粹炼金术框架。",
      "sources": ["SRC-015"],
      "evidence_grade": "I",
      "verification_status": "unreviewed",
      "status": "draft",
      "significance": "turning_point",
      "uncertainty": "文本对后世实验医学的实际影响程度仍属历史解释问题。",
      "cross_links": ["HIT-THT-007"],
      "chapter": "从长生术到近代延寿思想",
      "notes": "示例事件。"
    },
    {
      "event_id": "HIT-SCI-003",
      "title": "Hayflick 极限发表",
      "date_start": "1961",
      "date_type": "exact",
      "period_id": "period-20th-century",
      "civilization": "United States",
      "region": "North America",
      "path_family": "maintenance",
      "event_type": "technology",
      "claim": "正常人类体细胞只能分裂有限次数，推翻了正常体细胞天然不死的观念。",
      "summary": "Hayflick 和 Moorhead 把细胞衰老、染色体末端和癌细胞无限增殖联系起来。",
      "sources": ["SRC-034"],
      "evidence_grade": "T",
      "verification_status": "unreviewed",
      "status": "draft",
      "significance": "turning_point",
      "uncertainty": "细胞分裂极限不等于个体寿命极限；端粒、衰老细胞和癌变之间的因果链仍需分别审查。",
      "cross_links": ["HIT-TEC-002", "HIT-SCI-005"],
      "chapter": "老年学、进化论与细胞寿命",
      "notes": "示例事件。"
    }
  ]
}
